{"entries":[{"category":"other","context_tag":"unarchived","file_hash":"f929ebdacf0bc8ec7bfec4b329d843d6dc8a49da0d3b1283a4a63d047a336a765740366e087c303c3b4de43cdf770010eb1a30093dc76f92165fb252ccd0f748","hash_algo":"sha512","mime":"application/json","mtime":1764725411,"name":"nodupe_meta_v1.schema.json","size":1656,"subtype":"unknown","topic":null}],"folder_rel":"nodupe/schemas","generated_at":"2025-12-03T01:32:58Z","parent_rel":"nodupe","spec":"nodupe_meta_v1","summary":{"bytes_total":1656,"categories":{"other":1},"files_total":1,"keywords":["meta","nodupe","v1.schema"],"topics":[]}}
