{"entries":[{"category":"other","context_tag":"unarchived","file_hash":"aa32bc4fc2224ee6effd063d3ef13b78e84c66b1d7b6fd8d3011ebe8af567a14f1ee9f6b7c27db8764a543ab4e274ffa36cd540c0e125530b952edd0fa1892c3","hash_algo":"sha512","mime":"application/octet-stream","mtime":1764725445,"name":"nodupe.yml","size":555,"subtype":"unknown","topic":null},{"category":"other","context_tag":"unarchived","file_hash":"9d2d78602e3b9feebe1f610277b78e42a6b7bc8d65441ebcbfcd19358e154bb656f1dad571fe1a53337d0f9284c096bd06612243293948676e774470f3dad589","hash_algo":"sha512","mime":"application/octet-stream","mtime":1764725271,"name":"pyproject.toml","size":523,"subtype":"unknown","topic":null}],"folder_rel":".","generated_at":"2025-12-03T01:32:58Z","parent_rel":null,"spec":"nodupe_meta_v1","summary":{"bytes_total":1078,"categories":{"other":2},"files_total":2,"keywords":["nodupe","pyproject"],"topics":[]}}
