{"entries":[{"category":"video","context_tag":"unarchived","file_hash":"7a5e73c3e69eefa0586599a68441a05bd671fea5a30a338987fde05fe153e89b4171a0dfdc196ac7525a289945b5911085dead0a7d94f7abf6d6adb36789f461","hash_algo":"sha512","mime":"video/mp4","mtime":1764736981,"name":"6018070_converted.mp4","permissions":"0o660","size":140260,"subtype":"clip","topic":null},{"category":"video","context_tag":"unarchived","file_hash":"2d2f37a3db6d9d3a205eb692476421553ef71e8ef0c29002aa51e5dbc105fa56d6e956d8373da9aa47238abea3fd7ed67f8943f646c2b12850f962e14dc8b483","hash_algo":"sha512","mime":"video/webm","mtime":1764736982,"name":"6018070_converted.webm","permissions":"0o660","size":178339,"subtype":"clip","topic":null},{"category":"video","context_tag":"unarchived","file_hash":"72849d7ae713ee2b798f4fffa2f4d45c9537e01b1c4c99a305ec9e1ef8b52bd0806567ec4f98e95dcb09415db590a00c66cff7dc8bd95fc53758eb3dc444b011","hash_algo":"sha512","mime":"video/x-msvideo","mtime":1764737104,"name":"6018087_converted.avi","permissions":"0o660","size":28863568,"subtype":"clip","topic":null},{"category":"video","context_tag":"unarchived","file_hash":"07bae3422239580cee5574ff46d2b9e4ec8a92f1f2501f39d612abbb0c8cdad7073c4f82919288f4c850d18c1035a24205ff73e4d794531bc9ec2e8999bcad00","hash_algo":"sha512","mime":"video/x-matroska","mtime":1764737099,"name":"6018087_converted.mkv","permissions":"0o660","size":25834796,"subtype":"clip","topic":null},{"category":"video","context_tag":"unarchived","file_hash":"6aae128a5d0933301085c3966767c5999ebcbd8c1ee7e645c46f60eab517eac9485853200cc36eba0e0a1f3b31b63067f4ef8fdf22e4231152798fcf34405c33","hash_algo":"sha512","mime":"video/webm","mtime":1764737076,"name":"6018087_converted.webm","permissions":"0o660","size":11031163,"subtype":"clip","topic":null},{"category":"video","context_tag":"unarchived","file_hash":"ea7427cb5ae93ef820ba7aec02e30787752197829e5297bc8e01b6375e357dcded120a4aa42fa2b3b6903713380feb07d2134f6605d3fdf1f5097e7f2ff73b2f","hash_algo":"sha512","mime":"video/x-msvideo","mtime":1764736987,"name":"6018109_converted.avi","permissions":"0o660","size":2628586,"subtype":"clip","topic":null},{"category":"video","context_tag":"unarchived","file_hash":"64144314918ff47ddbc7216196310b8077b6c106c078dc8f477e6c039502199ec084fd3446c4fb762910260d4708d0a42bc4bb74b1c4368220b6f851c42e4947","hash_algo":"sha512","mime":"video/x-matroska","mtime":1764736986,"name":"6018109_converted.mkv","permissions":"0o660","size":3853452,"subtype":"clip","topic":null},{"category":"video","context_tag":"unarchived","file_hash":"aba7a326005735b9d108f9f073f62b2ab4cd9feaebc6d4f9d193d04378913eff03836c8d0b0de3483736314e8c6fd2cf1363a91d2eddfe8f3baf45e36efe627e","hash_algo":"sha512","mime":"video/mp4","mtime":1764736984,"name":"6018109_converted.mp4","permissions":"0o660","size":3901444,"subtype":"clip","topic":null}],"folder_rel":"converted","generated_at":"2025-12-03T04:47:13Z","parent_rel":".","spec":"nodupe_meta_v1","summary":{"bytes_total":76431608,"categories":{"video":8},"files_total":8,"keywords":["converted"],"topics":[]}}
