{"entries":[{"category":"image","context_tag":"unarchived","file_hash":"ca8925210fd20c849aa57732c97ffcf8ac79bc48404419db44633109161252efceb808c3f2faba14a9d4ea7f639c4ab0cd17ef104543349abfd72f4ddf91e87b","hash_algo":"sha512","mime":"image/jpeg","mtime":1764735405,"name":"art_mona_lisa.jpg","permissions":"0o660","size":72055,"subtype":"photo","topic":null},{"category":"image","context_tag":"unarchived","file_hash":"7a2705b8d2f7e582801198dbf90a2114ee03136d4200da45d8dfd49f9a2fee210369d2239b7391a8fb4f4d5fb783774f1f0e709a54579c0344bf30ab859b13a4","hash_algo":"sha512","mime":"image/jpeg","mtime":1764735250,"name":"example.jpg","permissions":"0o660","size":25722,"subtype":"photo","topic":null},{"category":"image","context_tag":"unarchived","file_hash":"21f670641653b2c80d28226a498ed9d27466691767a9ebde64fb982bc8afc6b21750a990bfc2a49340173c6a2a70a8fe59dd41e9dc62ada440f9205bb59a6422","hash_algo":"sha512","mime":"image/png","mtime":1764735499,"name":"logo_python.png","permissions":"0o660","size":83564,"subtype":"photo","topic":null},{"category":"image","context_tag":"unarchived","file_hash":"a9884be288655419a20b693642cbfc5c6ef1a221168bcbeaa0894da33b45953edbe684eabe41249b1c0ff06f3e4e0c1863f857a05fde47d2094a65d61f6008b2","hash_algo":"sha512","mime":"image/jpeg","mtime":1764735402,"name":"nature_river.jpg","permissions":"0o660","size":110805,"subtype":"photo","topic":null},{"category":"text","context_tag":"unarchived","file_hash":"943aaa297ec91eeacaaea233cf3028b7ecc1595628c21aa5e63313bc10cd8f9dec797644fbc3afd9142901329f4bbee8bb8a8de56f3eaec93d4660b468953837","hash_algo":"sha512","mime":"text/plain","mtime":1764735264,"name":"readme.txt","permissions":"0o660","size":110,"subtype":"textfile","topic":null},{"category":"image","context_tag":"unarchived","file_hash":"2c65ccc64eff529c9798a54ce53924c39dac0573a0b214176a60f8eb9673f1d91c1fc8bdd28dc2b51d48d471ed57bcd5cc21b6daeb7165cd2d3957f357d8b95f","hash_algo":"sha512","mime":"image/png","mtime":1764735250,"name":"transparency.png","permissions":"0o660","size":48941,"subtype":"photo","topic":null}],"folder_rel":".","generated_at":"2025-12-03T04:18:27Z","parent_rel":null,"spec":"nodupe_meta_v1","summary":{"bytes_total":341197,"categories":{"image":5,"text":1},"files_total":6,"keywords":["art","example","lisa","logo","mona","nature","python","readme","river","transparency"],"topics":[]}}
