{"entries":[{"category":"other","context_tag":"unarchived","file_hash":"cf83e1357eefb8bdf1542850d66d8007d620e4050b5715dc83f4a921d36ce9ce47d0d13c5d85f2b0ff8318d2877eec2f63b931bd47417a81a538327af927da3e","hash_algo":"sha512","mime":"text/x-python","mtime":1764725413,"name":"__init__.py","size":0,"subtype":"unknown","topic":null},{"category":"other","context_tag":"unarchived","file_hash":"fbe63f57be59a251573f85861ad8f4e614824f5b76bb435a73b447ceb55d2164deb1ae25c254dd4315377a7e57baf66867a4169b36f5a70f2367e0f6bf823994","hash_algo":"sha512","mime":"text/x-python","mtime":1764725411,"name":"applier.py","size":1875,"subtype":"unknown","topic":null},{"category":"other","context_tag":"unarchived","file_hash":"cfedd8e65d3742881638c0594ee3910824eb1b93896f8b238467c083eee798debc4051e437aaacc6d9d29fd5badff73b05b8c2db2b11f5034557f00b67ee5859","hash_algo":"sha512","mime":"text/x-python","mtime":1764725411,"name":"archiver.py","size":5537,"subtype":"unknown","topic":null},{"category":"other","context_tag":"unarchived","file_hash":"c24f93b0d640cbc21ae55929a78cf5965c121135f53d04c44c8ee71355d27f03e79e9cf54ab11b3a2510e8d40a4e3cfd7c14f2c2581ffb426e949920422c0f2a","hash_algo":"sha512","mime":"text/x-python","mtime":1764725411,"name":"categorizer.py","size":1051,"subtype":"unknown","topic":null},{"category":"other","context_tag":"unarchived","file_hash":"0acd42ec980fad9a5bbaca8853ac7d8761c637fb79a332e7846610c3285d0a9a667d2b9283244d6dfc0d1b885989c12cba8cd8ba2158c021cad23987ee83734e","hash_algo":"sha512","mime":"text/x-python","mtime":1764725429,"name":"cli.py","size":7589,"subtype":"unknown","topic":null},{"category":"other","context_tag":"unarchived","file_hash":"3a22843e4d7aec445662d2c1d97bbf6b9ccae28c8d94e39bb99d23b62e419de863a0eb062448d003704969f2947fb0ce1709f410a9aae4da588f6f89c9c4ad04","hash_algo":"sha512","mime":"text/x-python","mtime":1764725271,"name":"config.py","size":2055,"subtype":"unknown","topic":null},{"category":"other","context_tag":"unarchived","file_hash":"48563aae9975addbfcb58544fe3ac37cbaa1537e7800fd8501f5a60db77737d142f15286878d3bea3c5935bd0fc024851d5daa26b9e6613445941122dd27fb1c","hash_algo":"sha512","mime":"text/x-python","mtime":1764725271,"name":"db.py","size":3617,"subtype":"unknown","topic":null},{"category":"other","context_tag":"unarchived","file_hash":"f7e9f45d55ab40d1e038588f0da457195e6bc0e9e882bbec72d513aee8323ebd8d8eebb59350ba76c7ab9c5ef9a65d7b71be98138631f773c20786928d0d3ffb","hash_algo":"sha512","mime":"text/x-python","mtime":1764725411,"name":"deps.py","size":563,"subtype":"unknown","topic":null},{"category":"other","context_tag":"unarchived","file_hash":"a782e6ea988454979f38ae613137a9962462052843170faf927abe85b794796b5ebf2028b90bc73acc11999f849bc22fdd884f77bc53bee678752dbd59623b24","hash_algo":"sha512","mime":"text/x-python","mtime":1764725411,"name":"exporter.py","size":4956,"subtype":"unknown","topic":null},{"category":"other","context_tag":"unarchived","file_hash":"42f465d48ddc2ae57cb50051b7dbd5631a3ec540ff558bfc888c8d2ea9ee207e2ee1515de899dfa61579b2b03095b6c3c9341dd66fef9aa738464a6b54f839db","hash_algo":"sha512","mime":"text/x-python","mtime":1764725411,"name":"logger.py","size":1309,"subtype":"unknown","topic":null},{"category":"other","context_tag":"unarchived","file_hash":"c3359aa6bd88f5404265f35e25adc3ddde286131513da37d747f28f3f88284e8a9259c5e99c0106f0bc99459a678fa083c666c4675a1d952968d4a12f41ca4e9","hash_algo":"sha512","mime":"text/x-python","mtime":1764725411,"name":"metrics.py","size":715,"subtype":"unknown","topic":null},{"category":"other","context_tag":"unarchived","file_hash":"c0afa346b59b649f2c9a704865834441661d14f60b3fef982878cfbcb16a61fab402cbba967f4f2636ee2d436efede8aded4c1b61e294b189b0270fd72dddab9","hash_algo":"sha512","mime":"text/x-python","mtime":1764725411,"name":"planner.py","size":958,"subtype":"unknown","topic":null},{"category":"other","context_tag":"unarchived","file_hash":"8b68c657acb35d24d0a1b8035f21af9253bff6eb0e80b6f07958555542575f88e8907f6b75cbf357b746f1eb2202792fce90eb21f688167b056d3e38918c3101","hash_algo":"sha512","mime":"text/x-python","mtime":1764725486,"name":"rollback.py","size":1463,"subtype":"unknown","topic":null},{"category":"other","context_tag":"unarchived","file_hash":"35ea54ff0bb454b484ba81ba6a64ab00b536f2d0d0674316fcc8fb2b265d32fbc174e278aafd7e9e4b0cb51c40e464104a6d278201bf5b4374663e630479b238","hash_algo":"sha512","mime":"text/x-python","mtime":1764725271,"name":"scanner.py","size":4469,"subtype":"unknown","topic":null},{"category":"other","context_tag":"unarchived","file_hash":"73cb3bccbaaba34b516e6a1d1c96df188a8495cfa632a4462ff14f81f22e61fe9ecfe284c2495219dcaa3c4db5a33c8cc2eb59fd33d0b52ad2955feb48387995","hash_algo":"sha512","mime":"text/x-python","mtime":1764725411,"name":"validator.py","size":1353,"subtype":"unknown","topic":null}],"folder_rel":"nodupe","generated_at":"2025-12-03T01:32:18Z","parent_rel":".","spec":"nodupe_meta_v1","summary":{"bytes_total":37510,"categories":{"other":15},"files_total":15,"keywords":["applier","archiver","categorizer","cli","config","deps","exporter","init","logger","metrics","planner","rollback","scanner","validator"],"topics":[]}}
